{"artifact_manifest_identifier":"experiment-execution-readiness-offline-artifacts-v1","artifact_manifest_identity":"17623406a04ae36938e56480d6cce8257c0ce5e2d5cd410b5136eff40433525c","artifacts":[{"filename":"annotated_types-0.7.0-py3-none-any.whl","package_name":"annotated-types","relative_store_path":"sha256/1f02e8b43a8fbbc3f3e0d4f0f4bfc8131bcb4eebe8849b8e5c773f3a1c582a53.whl","sha256":"1f02e8b43a8fbbc3f3e0d4f0f4bfc8131bcb4eebe8849b8e5c773f3a1c582a53","version":"0.7.0"},{"filename":"anyio-4.14.2-py3-none-any.whl","package_name":"anyio","relative_store_path":"sha256/9f505dda5ac9f0c8309b5e8bd445a8c2bf7246f3ce950121e45ea15bc41d1494.whl","sha256":"9f505dda5ac9f0c8309b5e8bd445a8c2bf7246f3ce950121e45ea15bc41d1494","version":"4.14.2"},{"filename":"certifi-2026.7.22-py3-none-any.whl","package_name":"certifi","relative_store_path":"sha256/62f22742b58a1a33014a2b6b706588a8d7e2a88ae7bd1a6ebe8c992928483775.whl","sha256":"62f22742b58a1a33014a2b6b706588a8d7e2a88ae7bd1a6ebe8c992928483775","version":"2026.7.22"},{"filename":"h11-0.16.0-py3-none-any.whl","package_name":"h11","relative_store_path":"sha256/63cf8bbe7522de3bf65932fda1d9c2772064ffb3dae62d55932da54b31cb6c86.whl","sha256":"63cf8bbe7522de3bf65932fda1d9c2772064ffb3dae62d55932da54b31cb6c86","version":"0.16.0"},{"filename":"httpcore-1.0.9-py3-none-any.whl","package_name":"httpcore","relative_store_path":"sha256/2d400746a40668fc9dec9810239072b40b4484b640a8c38fd654a024c7a1bf55.whl","sha256":"2d400746a40668fc9dec9810239072b40b4484b640a8c38fd654a024c7a1bf55","version":"1.0.9"},{"filename":"httpx-0.28.1-py3-none-any.whl","package_name":"httpx","relative_store_path":"sha256/d909fcccc110f8c7faf814ca82a9a4d816bc5a6dbfea25d6591d6985b8ba59ad.whl","sha256":"d909fcccc110f8c7faf814ca82a9a4d816bc5a6dbfea25d6591d6985b8ba59ad","version":"0.28.1"},{"filename":"idna-3.18-py3-none-any.whl","package_name":"idna","relative_store_path":"sha256/7f952cbe720b688055e3f87de14f5c3e5fdaa8bc3928985c4077ca689de849a2.whl","sha256":"7f952cbe720b688055e3f87de14f5c3e5fdaa8bc3928985c4077ca689de849a2","version":"3.18"},{"filename":"iniconfig-2.3.0-py3-none-any.whl","package_name":"iniconfig","relative_store_path":"sha256/f631c04d2c48c52b84d0d0549c99ff3859c98df65b3101406327ecc7d53fbf12.whl","sha256":"f631c04d2c48c52b84d0d0549c99ff3859c98df65b3101406327ecc7d53fbf12","version":"2.3.0"},{"filename":"joblib-1.5.3-py3-none-any.whl","package_name":"joblib","relative_store_path":"sha256/5fc3c5039fc5ca8c0276333a188bbd59d6b7ab37fe6632daa76bc7f9ec18e713.whl","sha256":"5fc3c5039fc5ca8c0276333a188bbd59d6b7ab37fe6632daa76bc7f9ec18e713","version":"1.5.3"},{"filename":"jsonalias-0.1.1-py3-none-any.whl","package_name":"jsonalias","relative_store_path":"sha256/a56d2888e6397812c606156504e861e8ec00e188005af149f003c787db3d3f18.whl","sha256":"a56d2888e6397812c606156504e861e8ec00e188005af149f003c787db3d3f18","version":"0.1.1"},{"filename":"narwhals-2.24.0-py3-none-any.whl","package_name":"narwhals","relative_store_path":"sha256/42fdedf44e5b2ca7505630d45b4ac3058f38d8485cba9fe1652ca23152df7489.whl","sha256":"42fdedf44e5b2ca7505630d45b4ac3058f38d8485cba9fe1652ca23152df7489","version":"2.24.0"},{"filename":"numpy-2.5.1-cp314-cp314-macosx_14_0_arm64.whl","package_name":"numpy","relative_store_path":"sha256/efd736408cc97c79b9e6917338dfc8f06013b2274f992e96b1d9a81a71e2a2c2.whl","sha256":"efd736408cc97c79b9e6917338dfc8f06013b2274f992e96b1d9a81a71e2a2c2","version":"2.5.1"},{"filename":"packaging-26.2-py3-none-any.whl","package_name":"packaging","relative_store_path":"sha256/5fc45236b9446107ff2415ce77c807cee2862cb6fac22b8a73826d0693b0980e.whl","sha256":"5fc45236b9446107ff2415ce77c807cee2862cb6fac22b8a73826d0693b0980e","version":"26.2"},{"filename":"pandas-3.0.5-cp314-cp314-macosx_11_0_arm64.whl","package_name":"pandas","relative_store_path":"sha256/53730687fcd161883b24e10411c06d6a4c0f2275d2faf3bb2bc25deb4ba8007c.whl","sha256":"53730687fcd161883b24e10411c06d6a4c0f2275d2faf3bb2bc25deb4ba8007c","version":"3.0.5"},{"filename":"pluggy-1.6.0-py3-none-any.whl","package_name":"pluggy","relative_store_path":"sha256/e920276dd6813095e9377c0bc5566d94c932c33b27a3e3945d8389c374dd4746.whl","sha256":"e920276dd6813095e9377c0bc5566d94c932c33b27a3e3945d8389c374dd4746","version":"1.6.0"},{"filename":"pydantic-2.13.4-py3-none-any.whl","package_name":"pydantic","relative_store_path":"sha256/45a282cde31d808236fd7ea9d919b128653c8b38b393d1c4ab335c62924d9aba.whl","sha256":"45a282cde31d808236fd7ea9d919b128653c8b38b393d1c4ab335c62924d9aba","version":"2.13.4"},{"filename":"pydantic_core-2.46.4-cp314-cp314-macosx_11_0_arm64.whl","package_name":"pydantic-core","relative_store_path":"sha256/23ace664830ee0bfe014a0c7bc248b1f7f25ed7ad103852c317624a1083af462.whl","sha256":"23ace664830ee0bfe014a0c7bc248b1f7f25ed7ad103852c317624a1083af462","version":"2.46.4"},{"filename":"pygments-2.20.0-py3-none-any.whl","package_name":"pygments","relative_store_path":"sha256/81a9e26dd42fd28a23a2d169d86d7ac03b46e2f8b59ed4698fb4785f946d0176.whl","sha256":"81a9e26dd42fd28a23a2d169d86d7ac03b46e2f8b59ed4698fb4785f946d0176","version":"2.20.0"},{"filename":"pytest-9.1.1-py3-none-any.whl","package_name":"pytest","relative_store_path":"sha256/37a86b45efb9a47a61a36449063e8e18d0cab3161329fc099eb21783169c4f0c.whl","sha256":"37a86b45efb9a47a61a36449063e8e18d0cab3161329fc099eb21783169c4f0c","version":"9.1.1"},{"filename":"python_dateutil-2.9.0.post0-py2.py3-none-any.whl","package_name":"python-dateutil","relative_store_path":"sha256/a8b2bc7bffae282281c8140a97d3aa9c14da0b136dfe83f850eea9a5f7470427.whl","sha256":"a8b2bc7bffae282281c8140a97d3aa9c14da0b136dfe83f850eea9a5f7470427","version":"2.9.0.post0"},{"filename":"scikit_learn-1.9.0-cp314-cp314-macosx_12_0_arm64.whl","package_name":"scikit-learn","relative_store_path":"sha256/24360002ae845e7866522b0a5bbf690802e7bc388cac8663502e78aa98598aa2.whl","sha256":"24360002ae845e7866522b0a5bbf690802e7bc388cac8663502e78aa98598aa2","version":"1.9.0"},{"filename":"scipy-1.18.0-cp314-cp314-macosx_14_0_arm64.whl","package_name":"scipy","relative_store_path":"sha256/f2a6af57bd9e4a75d70e4117e78a1bbee84f79ae3fbb6d0111005d6ebcc4cb8d.whl","sha256":"f2a6af57bd9e4a75d70e4117e78a1bbee84f79ae3fbb6d0111005d6ebcc4cb8d","version":"1.18.0"},{"filename":"six-1.17.0-py2.py3-none-any.whl","package_name":"six","relative_store_path":"sha256/4721f391ed90541fddacab5acf947aa0d3dc7d27b2e1e8eda2be8970586c3274.whl","sha256":"4721f391ed90541fddacab5acf947aa0d3dc7d27b2e1e8eda2be8970586c3274","version":"1.17.0"},{"filename":"solders-0.28.0-cp310-abi3-macosx_10_12_x86_64.macosx_11_0_arm64.macosx_10_12_universal2.whl","package_name":"solders","relative_store_path":"sha256/07844e22f7a7b8fd698a46f2a09d355d35d9898a1bd86017ba6cb519eb11e4c1.whl","sha256":"07844e22f7a7b8fd698a46f2a09d355d35d9898a1bd86017ba6cb519eb11e4c1","version":"0.28.0"},{"filename":"threadpoolctl-3.6.0-py3-none-any.whl","package_name":"threadpoolctl","relative_store_path":"sha256/43a0b8fd5a2928500110039e43a5eed8480b918967083ea48dc3ab9f13c4a7fb.whl","sha256":"43a0b8fd5a2928500110039e43a5eed8480b918967083ea48dc3ab9f13c4a7fb","version":"3.6.0"},{"filename":"typing_extensions-4.16.0-py3-none-any.whl","package_name":"typing-extensions","relative_store_path":"sha256/481caa481374e813c1b176ada14e97f1f67a4539ce9cfeb3f350d78d6370c2e8.whl","sha256":"481caa481374e813c1b176ada14e97f1f67a4539ce9cfeb3f350d78d6370c2e8","version":"4.16.0"},{"filename":"typing_inspection-0.4.2-py3-none-any.whl","package_name":"typing-inspection","relative_store_path":"sha256/4ed1cacbdc298c220f1bd249ed5287caa16f34d44ef4e9c3d0cbad5b521545e7.whl","sha256":"4ed1cacbdc298c220f1bd249ed5287caa16f34d44ef4e9c3d0cbad5b521545e7","version":"0.4.2"}],"dependency_lock_sha256":"11afcc39df18db5b1d90fb7355decb0d4c96a02ee602f3cdce9b23b0d6682258","schema_version":1,"store_layout":"sha256-content-addressed-wheel-store-v1"}
